[
  {
    "id": "",
    "v": 1,
    "ts": "2026-10-09T10:00:03Z",
    "received_at": "2026-10-09T10:00:00Z",
    "kind": "usage",
    "agent": {
      "name": "claude-code",
      "version": "2.1.290"
    },
    "collector": "transcript",
    "session_id": "claude-code:sess-0001",
    "actor_id": "claude-code:sess-0001",
    "project": {
      "cwd": "/home/dev/demo"
    },
    "data": {
      "cache_read_tokens": 23147,
      "cache_write_tokens": 18432,
      "cost_source": "computed",
      "cost_usd": 0.1006174,
      "input_tokens": 2,
      "message_id": "msg_A",
      "model": "claude-opus-5-5",
      "output_tokens": 191
    },
    "dedup_key": "claude-code:usage:msg_A"
  },
  {
    "id": "",
    "v": 1,
    "ts": "2026-10-09T10:00:03.2Z",
    "received_at": "2026-10-09T10:00:00Z",
    "kind": "tool.start",
    "agent": {
      "name": "claude-code"
    },
    "collector": "transcript",
    "session_id": "claude-code:sess-0001",
    "actor_id": "claude-code:sess-0001",
    "project": {
      "cwd": "/home/dev/demo"
    },
    "data": {
      "input_summary": "greet",
      "tool": "search",
      "tool_call_id": "toolu_01",
      "tool_raw": "Grep"
    },
    "dedup_key": "claude-code:sess-0001:toolu_01:start"
  },
  {
    "id": "",
    "v": 1,
    "ts": "2026-10-09T10:00:03.2Z",
    "received_at": "2026-10-09T10:00:00Z",
    "kind": "usage",
    "agent": {
      "name": "claude-code",
      "version": "2.1.290"
    },
    "collector": "transcript",
    "session_id": "claude-code:sess-0001",
    "actor_id": "claude-code:sess-0001",
    "project": {
      "cwd": "/home/dev/demo"
    },
    "data": {
      "cache_read_tokens": 23147,
      "cache_write_tokens": 18432,
      "cost_source": "computed",
      "cost_usd": 0.1006174,
      "input_tokens": 2,
      "message_id": "msg_A",
      "model": "claude-opus-5-5",
      "output_tokens": 191
    },
    "dedup_key": "claude-code:usage:msg_A"
  },
  {
    "id": "",
    "v": 1,
    "ts": "2026-10-09T10:00:09Z",
    "received_at": "2026-10-09T10:00:00Z",
    "kind": "usage",
    "agent": {
      "name": "claude-code",
      "version": "2.1.290"
    },
    "collector": "transcript",
    "session_id": "claude-code:sess-0001",
    "actor_id": "claude-code:sess-0001",
    "project": {
      "cwd": "/home/dev/demo"
    },
    "data": {
      "cache_read_tokens": 41579,
      "cache_write_1h_tokens": 2000,
      "cache_write_tokens": 3000,
      "cost_source": "computed",
      "cost_usd": 0.0377358,
      "input_tokens": 5,
      "message_id": "msg_B",
      "model": "claude-opus-5-5",
      "output_tokens": 420
    },
    "dedup_key": "claude-code:usage:msg_B"
  },
  {
    "id": "",
    "v": 1,
    "ts": "2026-10-09T10:00:05Z",
    "received_at": "2026-10-09T10:00:00Z",
    "kind": "usage",
    "agent": {
      "name": "claude-code",
      "version": "2.1.290"
    },
    "collector": "transcript",
    "session_id": "claude-code:sess-0001",
    "actor_id": "claude-code:sess-0001/sub:ag-7",
    "parent_actor": "claude-code:sess-0001",
    "data": {
      "cache_read_tokens": 0,
      "cache_write_tokens": 0,
      "cost_source": "computed",
      "cost_usd": 0.00016,
      "input_tokens": 1200,
      "message_id": "msg_S",
      "model": "claude-haiku-5-5",
      "output_tokens": 80
    },
    "dedup_key": "claude-code:usage:msg_S"
  },
  {
    "id": "",
    "v": 1,
    "ts": "2026-10-09T10:00:12Z",
    "received_at": "2026-10-09T10:00:00Z",
    "kind": "usage",
    "agent": {
      "name": "claude-code",
      "version": "2.1.290"
    },
    "collector": "transcript",
    "session_id": "claude-code:sess-0001",
    "actor_id": "claude-code:sess-0001",
    "data": {
      "cache_read_tokens": 0,
      "cache_write_tokens": 0,
      "cost_source": "unpriced",
      "input_tokens": 10,
      "message_id": "msg_X",
      "model": "claude-future-9",
      "output_tokens": 10
    },
    "dedup_key": "claude-code:usage:msg_X"
  },
  {
    "id": "",
    "v": 1,
    "ts": "2026-10-09T10:00:00Z",
    "received_at": "2026-10-09T10:00:00Z",
    "kind": "session.update",
    "agent": {
      "name": "claude-code"
    },
    "collector": "transcript",
    "session_id": "claude-code:sess-0001",
    "actor_id": "claude-code:sess-0001",
    "data": {
      "title": "Fix greeting test",
      "title_source": "agent"
    },
    "dedup_key": "claude-code:sess-0001:title:fbd65c171698aeb6"
  },
  {
    "id": "",
    "v": 1,
    "ts": "2026-10-09T10:00:13Z",
    "received_at": "2026-10-09T10:00:00Z",
    "kind": "usage",
    "agent": {
      "name": "claude-code",
      "version": "2.1.290"
    },
    "collector": "transcript",
    "session_id": "claude-code:sess-0001",
    "actor_id": "claude-code:sess-0001",
    "data": {
      "cache_read_tokens": 0,
      "cache_write_tokens": 0,
      "cost_source": "computed",
      "cost_usd": 0.0432,
      "inference_geo": "us",
      "input_tokens": 1000,
      "message_id": "msg_W",
      "model": "claude-opus-5-5",
      "output_tokens": 100,
      "speed": "fast",
      "web_searches": 3
    },
    "dedup_key": "claude-code:usage:msg_W"
  },
  {
    "id": "",
    "v": 1,
    "ts": "2026-10-09T10:00:00Z",
    "received_at": "2026-10-09T10:00:00Z",
    "kind": "usage",
    "agent": {
      "name": "claude-code"
    },
    "collector": "transcript",
    "session_id": "claude-code:sess-0001",
    "actor_id": "claude-code:sess-0001",
    "data": {
      "cost_source": "reported",
      "model_usage": {
        "claude-haiku-4-5-20251001": {
          "costUSD": 0.05,
          "inputTokens": 40000,
          "outputTokens": 800,
          "webSearchRequests": 1
        },
        "claude-opus-5-5": {
          "costUSD": 0.2,
          "inputTokens": 1017,
          "outputTokens": 711
        }
      },
      "process": "claude-code:1791367200000",
      "report": true,
      "total_cost_usd": 0.25
    },
    "dedup_key": "claude-code:sess-0001:cost-state:1791367200000:0.250000000"
  },
  {
    "id": "",
    "v": 1,
    "ts": "2026-10-09T10:00:00Z",
    "received_at": "2026-10-09T10:00:00Z",
    "kind": "usage",
    "agent": {
      "name": "claude-code"
    },
    "collector": "transcript",
    "session_id": "claude-code:sess-0001",
    "actor_id": "claude-code:sess-0001",
    "data": {
      "cost_source": "reported",
      "process": "claude-code:1791367200000",
      "report": true,
      "total_cost_usd": 0.25
    },
    "dedup_key": "claude-code:sess-0001:cost-state:1791367200000:0.250000000"
  }
]
